<?xml version="1.0"?>

<author xmlns:xsi="http://www.w3.org/2001/XMLSchema-instance"
        xsi:noNamespaceSchemaLocation="author.xsd">
   <author_info>
      <author_id>1</author_id>
      <first_name>Stephen</first_name>
      <last_name>King</last_name>
   </author_info>

   <author_info>
      <author_id>2</author_id>
      <first_name>James</first_name>
      <last_name>Hilton</last_name>
   </author_info>

   <author_info>
      <author_id>3</author_id>
      <first_name>Felix</first_name>
      <last_name>Salten</last_name>
   </author_info>

   <author_info>
      <author_id>4</author_id>
      <first_name>Hector</first_name>
      <last_name>Garcia-Milina</last_name>
   </author_info>

   <author_info>
      <author_id>5</author_id>
      <first_name>Jeffry</first_name>
      <last_name>Ullman</last_name>
   </author_info>

   <author_info>
      <author_id>6</author_id>
      <first_name>Jennifer</first_name>
      <last_name>Widom</last_name>
   </author_info>

   <author_info>
      <author_id>7</author_id>
      <first_name>Prentice</first_name>
      <last_name>Hall</last_name>
   </author_info>
</author>